{"model_publication":{"bundle_sha256":"2222222222222222222222222222222222222222222222222222222222222222","revision":"1111111111111111111111111111111111111111","source_locator":"SeniorAILab/synthetic"},"runtime_format":"onnxruntime","schema_version":3,"threshold_source":"default","transition_threshold":0.5}
